{
  "$schema": "https://json-schema.org/draft/2020-12/schema",
  "title": "ToolCallResult",
  "type": "object",
  "required": [
    "id",
    "tool_id",
    "tool_name",
    "tool_type",
    "input",
    "output",
    "executed",
    "status"
  ],
  "properties": {
    "id": {
      "type": "string",
      "description": "Stable identifier for this portable OACS record."
    },
    "tool_id": {
      "type": "string",
      "description": "ToolBinding identifier for the tool that produced this result."
    },
    "tool_name": {
      "type": "string",
      "description": "Human-readable tool name captured with the result."
    },
    "tool_type": {
      "type": "string",
      "description": "Portable tool type captured with the result."
    },
    "actor_id": {
      "type": [
        "string",
        "null"
      ],
      "description": "Optional actor identifier associated with this operation or projection."
    },
    "attribution": {
      "type": [
        "object",
        "null"
      ],
      "description": "Portable provenance for the tool result: the observed tool, the recording actor, and the role of the result.",
      "required": [
        "role"
      ],
      "properties": {
        "source_actor_id": {
          "type": [
            "string",
            "null"
          ],
          "description": "Tool or actor-like identifier that originated the observation."
        },
        "source_actor_type": {
          "type": [
            "string",
            "null"
          ],
          "enum": [
            "human",
            "agent",
            "tool",
            "service",
            "application",
            "organization",
            "system",
            null
          ],
          "description": "Portable type of the originating source."
        },
        "recorded_by_actor_id": {
          "type": [
            "string",
            "null"
          ],
          "description": "Actor identifier for the runtime or agent that recorded the tool result."
        },
        "role": {
          "type": "string",
          "enum": [
            "user_instruction",
            "agent_decision",
            "tool_observation",
            "project_policy",
            "human_approval",
            "derived_memory",
            "system_policy"
          ],
          "description": "How this result should be interpreted by context consumers."
        },
        "confidence": {
          "type": "number",
          "minimum": 0,
          "maximum": 1,
          "description": "Confidence in the attribution metadata, not in the tool output."
        }
      },
      "additionalProperties": false
    },
    "scope": {
      "type": "array",
      "items": {
        "type": "string"
      },
      "description": "Portable scope labels that constrain where the record applies."
    },
    "input": {
      "type": "object",
      "description": "Tool input captured as evidence metadata; sensitive values must be protected references."
    },
    "output": {
      "type": "object",
      "description": "Tool output captured as evidence metadata; sensitive values must be redacted or externalized."
    },
    "evidence_ref": {
      "type": [
        "string",
        "null"
      ],
      "description": "EvidenceRef identifier created for this tool result."
    },
    "executed": {
      "type": "boolean",
      "description": "Whether the tool was actually executed when the result was captured."
    },
    "status": {
      "type": "string",
      "description": "Lifecycle status for this record in the portable OACS model."
    }
  },
  "additionalProperties": false
}
